{
  "cluster_id": "cluster_123",
  "organization_id": "org_123",
  "project_id": "project_123",
  "environment_id": "env_123",
  "region": "us-east-1",
  "postgres_version": "18",
  "tier": "dev",
  "storage_gib": 20,
  "lifecycle_state": "allocating_storage",
  "host_assignment": {
    "host_id": "local-dev-host",
    "data_dir": "/var/lib/palimpsest/postgres/cluster_123",
    "port": 55000
  }
}
